<binaryStream
  xmlns="http://coastwatch.noaa.gov"
  xmlns:xsi="http://www.w3.org/2001/XMLSchema-instance"
  xsi:schemaLocation="http://coastwatch.noaa.gov http://coastwatch.noaa.gov/xml/binaryStream.xsd">

  <!-- Scan line section -->
  <ushort name="lineNumber"/>
  <ushort name="year"/>
  <ushort name="day"/>
  <uint name="timeUTC" absoluteOffset="8"/>
  <ushort name="majorFrameCount" absoluteOffset="14"/>
  <ushort name="scanPosition"/>
  <ushort name="scanType"/>

  <!-- Quality section -->
  <uint name="qualityIndicator" absoluteOffset="28">
    <bitLabel name="qualityIndicator.doNotUseScan" position="31"/>
    <bitLabel name="qualityIndicator.timeSequenceError" position="30"/>
    <bitLabel name="qualityIndicator.dataGap" position="29"/>
    <bitLabel name="qualityIndicator.calibrationAnomaly" position="28"/>
    <bitLabel name="qualityIndicator.navigationUnavailable" position="27"/>
    <bitLabel name="qualityIndicator.clockUpdated" position="26"/>
    <bitLabel name="qualityIndicator.statusChanged" position="25"/>
  </uint>
  <ubyte name="calibrationProblem" absoluteOffset="34">
    <bitLabel name="calibrationProblem.scanNotCalibrated" position="7"/>
    <bitLabel name="calibrationProblem.marginalIR" position="6"/>
    <bitLabel name="calibrationProblem.prtQualityFailed" position="5"/>
    <bitLabel name="calibrationProblem.prtMarginal" position="4"/>
    <bitLabel name="calibrationProblem.uncalibratedChannels" position="3"/>
    <bitLabel name="calibrationProblem.calibrationDisabled" position="2"/>
    <bitLabel name="calibrationProblem.lunarContamination" position="1"/>
  </ubyte>

  <!-- Calibration section -->
  <int name="ch1SecondOrder" scale="1e-12" absoluteOffset="156"/>
  <int name="ch1FirstOrder" scale="1e-9" />
  <int name="ch1ZerothOrder" scale="1e-6" />
  <int name="ch17SecondOrder" scale="1e-12"/>
  <int name="ch17FirstOrder" scale="1e-9"/>
  <int name="ch17ZerothOrder" scale="1e-6"/>
  <int name="ch2SecondOrder" scale="1e-12"/>
  <int name="ch2FirstOrder" scale="1e-9"/>
  <int name="ch2ZerothOrder" scale="1e-6"/>
  <int name="ch3SecondOrder" scale="1e-12"/>
  <int name="ch3FirstOrder" scale="1e-9"/>
  <int name="ch3ZerothOrder" scale="1e-6"/>
  <int name="ch13SecondOrder" scale="1e-12"/>
  <int name="ch13FirstOrder" scale="1e-9"/>
  <int name="ch13ZerothOrder" scale="1e-6"/>
  <int name="ch4SecondOrder" scale="1e-12"/>
  <int name="ch4FirstOrder" scale="1e-9"/>
  <int name="ch4ZerothOrder" scale="1e-6"/>
  <int name="ch18SecondOrder" scale="1e-12"/>
  <int name="ch18FirstOrder" scale="1e-9"/>
  <int name="ch18ZerothOrder" scale="1e-6"/>
  <int name="ch11SecondOrder" scale="1e-12"/>
  <int name="ch11FirstOrder" scale="1e-9"/>
  <int name="ch11ZerothOrder" scale="1e-6"/>
  <int name="ch19SecondOrder" scale="1e-12"/>
  <int name="ch19FirstOrder" scale="1e-9"/>
  <int name="ch19ZerothOrder" scale="1e-6"/>
  <int name="ch7SecondOrder" scale="1e-12"/>
  <int name="ch7FirstOrder" scale="1e-9"/>
  <int name="ch7ZerothOrder" scale="1e-6"/>
  <int name="ch8SecondOrder" scale="1e-12"/>
  <int name="ch8FirstOrder" scale="1e-9"/>
  <int name="ch8ZerothOrder" scale="1e-6"/>
  <int name="ch20SecondOrder" scale="1e-12"/>
  <int name="ch20FirstOrder" scale="1e-9"/>
  <int name="ch20ZerothOrder" scale="1e-6"/>
  <int name="ch10SecondOrder" scale="1e-12"/>
  <int name="ch10FirstOrder" scale="1e-9"/>
  <int name="ch10ZerothOrder" scale="1e-6"/>
  <int name="ch14SecondOrder" scale="1e-12"/>
  <int name="ch14FirstOrder" scale="1e-9"/>
  <int name="ch14ZerothOrder" scale="1e-6"/>
  <int name="ch6SecondOrder" scale="1e-12"/>
  <int name="ch6FirstOrder" scale="1e-9"/>
  <int name="ch6ZerothOrder" scale="1e-6"/>
  <int name="ch5SecondOrder" scale="1e-12"/>
  <int name="ch5FirstOrder" scale="1e-9"/>
  <int name="ch5ZerothOrder" scale="1e-6"/>
  <int name="ch15SecondOrder" scale="1e-12"/>
  <int name="ch15FirstOrder" scale="1e-9"/>
  <int name="ch15ZerothOrder" scale="1e-6"/>
  <int name="ch12SecondOrder" scale="1e-12"/>
  <int name="ch12FirstOrder" scale="1e-9"/>
  <int name="ch12ZerothOrder" scale="1e-6"/>
  <int name="ch16SecondOrder" scale="1e-12"/>
  <int name="ch16FirstOrder" scale="1e-9"/>
  <int name="ch16ZerothOrder" scale="1e-6"/>
  <int name="ch9SecondOrder" scale="1e-12"/>
  <int name="ch9FirstOrder" scale="1e-9"/>
  <int name="ch9ZerothOrder" scale="1e-6"/>

  <!-- Navigation section -->
  <uint name="navigationStatus" absoluteOffset="648"/>
  <shortArray name="angles" dims="168" absoluteOffset="664"/>
  <intArray name="earthLocations" dims="112" absoluteOffset="1000"/>

  <!-- HIRS data section --> 
  <shortArray name="hirsData" dims="1344" absoluteOffset="1456"/>

</binaryStream>

